Kentucky,HB9,AN ACT relating to postsecondary education and declaring an emergency.,DEI Ban,2/14/2024,"floor amendments (1), (2) and (3) filed",Worst,Moderate,,https://legiscan.com/KY/bill/HB9/2024,"Jennifer Henson Decker, Shane Baker, Jared Bauman, Danny Bentley, Josh Calloway, Steven Doan, Daniel Fister, Chris Fugate, Matt Lockett, Candy Massaroni, Bobby McCool, Jason Nemes, Marianne Proctor, Felicia Rabourn, Steve Rawlings, Nancy Tate, Timmy Truett, Billy Wesley",,"H 2024-01-19 introduced in House, H 2024-01-19 to Committee on Committees (H), H 2024-01-25 to Education (H), H 2024-02-14 floor amendments (1), (2) and (3) filed",Failed,365e48996ef90c2683e40c22bb7214f2,1822104,https://apps.legislature.ky.gov/recorddocuments/bill/24RS/hb9/orig_bill.pdf,,https://drive.google.com/open?id=1xVGAcEIww11CNd-DCbooyQVqLK35DKUN
Kentucky,SB147,AN ACT relating to adult-oriented businesses and declaring an emergency.,Drag Ban,3/26/2024,floor amendment (2) filed to Committee Substitute,Worst,Moderate,,https://legiscan.com/KY/bill/SB147/2024,"Lindsey Tichenor, Gex Williams, Gary Boswell, Matthew Deneen, Rick Girdler, Stephen Meredith, Robert Mills, John Schickel, Adrienne Southworth, Johnnie Turner, Steve West, Mike Wilson, George Wise","Hearing 2024-02-29 09:00 Annex Room 131, Hearing 2024-03-19 13:00 Annex Room 169","S 2024-01-30 introduced in Senate, S 2024-01-30 to Committee on Committees (S), S 2024-02-01 to Veterans, Military Affairs, & Public Protection (S), S 2024-02-29 reported favorably, 1st reading, to Calendar with Committee Substitute (1), S 2024-02-29 floor amendment (1) filed to Committee Substitute, S 2024-03-01 2nd reading, to Rules, S 2024-03-01 posted for passage in the Regular Orders of the Day for Tuesday, March 05, 2024, S 2024-03-04 floor amendment (2) filed to Committee Substitute, S 2024-03-05 passed over and retained in the Orders of the Day, S 2024-03-05 floor amendment (3) filed to Committee Substitute, S 2024-03-06 3rd reading, S 2024-03-06 floor amendment (1) withdrawn, S 2024-03-06 passed 32-6 with Committee Substitute (1) and Floor Amendments (2) and (3), H 2024-03-07 received in House, H 2024-03-07 to Committee on Committees (H), H 2024-03-08 to Veterans, Military Affairs, & Public Protection (H), H 2024-03-21 reported favorably, 1st reading, to Calendar with Committee Substitute (1), H 2024-03-22 2nd reading, to Rules, H 2024-03-25 floor amendment (1) filed to Committee Substitute, H 2024-03-26 floor amendment (2) filed to Committee Substitute",Failed,de936b7b208a803c0191f3b34c2c2bf6,1832251,"https://apps.legislature.ky.gov/recorddocuments/bill/24RS/sb147/orig_bill.pdf, https://apps.legislature.ky.gov/recorddocuments/bill/24RS/sb147/bill.pdf",,https://drive.google.com/open?id=1EU8_Bu3PH00CYyHN7Kp7FSVXlhq1Qff3
Kentucky,SB208,"Amend KRS 600.020 to separate the definitions of ""abused child"" and ""neglected child""; amend the definition of ""physical injury"" to include the requirement that it is likely to cause death or disfigurement or impairment of an organ; amend KRS 620.040 and 620.050 to require that interviews of any party by the cabinet must be recorded and retained for five years; amend KRS 620.072 to remove ""neglect""; amend KRS 625.090 to remove ""neglect"" as a basis for a termination of parental rights; amend various KRS sections to conform.",Gender Affirming Care Ban / Trans Child Abuse,2/16/2024,to Families & Children (S),Worst,Moderate,"Equates medical GAC of a minor to child abuse by defining physical abuse to include ""Protracted loss or impairment of function of any bodily organ""",https://legiscan.com/KY/bill/SB208/2024,,,,Failed,,,,,
Kentucky,SB239,Create new sections of KRS Chapter 344 to ensure federal law relating to emergency medical treatment and the collection of evidence is not overridden; define terms; prohibit discrimination against medical care providers who decline to perform procedures that violate their conscience; grant providers the right not to participate in or pay for services that violate their conscience; exempt providers from liability for exercising these rights; prohibit the State Board of Medical Licensure from reprimanding medical practitioners and require the board to provide complaints it has received to medical practitioners; establish a civil cause of action for persons injured by violations; provide that the Act may be cited as the Healthcare Heroes Recruitment and Retention Act; EMERGENCY.,Legal Discrimination in Healthcare,3/22/2024,to Committee on Committees (H),Worst,Moderate,,https://legiscan.com/KY/bill/SB239/2024,,,,Failed,,,,,
Kentucky,SB246,"AN ACT relating to materials, programs, or events alleged to be harmful to minors.",Book Ban,2/26/2024,to Education (S),Worst,Moderate,,https://legiscan.com/KY/bill/SB246/2024,"Lindsey Tichenor, Stephen Meredith",,"S 2024-02-22 introduced in Senate, S 2024-02-22 to Committee on Committees (S), S 2024-02-26 to Education (S)",Failed,794631c997d4cd5bd8caf1ec1abc8517,1853463,https://apps.legislature.ky.gov/recorddocuments/bill/24RS/sb246/orig_bill.pdf,,https://drive.google.com/open?id=11Wr3drYo35O1FGOdqjUTicegZlphrf6a
Kentucky,SB276,AN ACT relating to the protection of minors.,Online Obscenity Law,3/12/2024,WITHDRAWN,Worst,Moderate,,https://legiscan.com/KY/bill/SB276/2024,Lindsey Tichenor,,"S 2024-02-26 introduced in Senate, S 2024-02-26 to Committee on Committees (S), S 2024-02-28 to Veterans, Military Affairs, & Public Protection (S), S 2024-03-12 WITHDRAWN",Failed,5bb0f621cbbaefeb5fbc35735a9eee3d,1854826,https://apps.legislature.ky.gov/recorddocuments/bill/24RS/sb276/orig_bill.pdf,,https://drive.google.com/open?id=1dgLFDsxz9i7NL9_RN0tRhWBaj5ukdYse
Kentucky,SB336,AN ACT relating to sex-based classifications.,End Legal Recognition,3/1/2024,"to Veterans, Military Affairs, & Public Protection (S)",Worst,Moderate,"Uses IWF and WoLF's ""Women's Bill of Rights"" Language",https://legiscan.com/KY/bill/SB336/2024,"Lindsey Tichenor, Shelley Frommeyer, Stephen Meredith",,"S 2024-02-28 introduced in Senate, S 2024-02-28 to Committee on Committees (S), S 2024-03-01 to Veterans, Military Affairs, & Public Protection (S)",Failed,bfc04b0bde8c08c58e8b23667df0a9a3,1856357,https://apps.legislature.ky.gov/recorddocuments/bill/24RS/sb336/orig_bill.pdf,,https://drive.google.com/open?id=14EDBUXB-q9l00zzL32unm-KB5Wfk_RcC
Kentucky,SB6,AN ACT relating to postsecondary institutions.,DEI Ban,4/12/2024,posted for passage for concurrence in House Committee Substitute (1),Worst,Moderate,,https://legiscan.com/KY/bill/SB6/2024,"Mike Wilson, Gary Boswell, Matthew Deneen, Donald Douglas, Stephen Meredith, Robert Mills, John Schickel, Damon Thayer, Lindsey Tichenor, Phillip Wheeler, Gex Williams, George Wise","Hearing 2024-02-08 10:00 Annex Room 129, Hearing 2024-02-08 11:00 Annex Room 131, Hearing 2024-03-14 00:00 Annex Room 154","S 2024-01-02 introduced in Senate, S 2024-01-02 to Committee on Committees (S), S 2024-01-03 to Education (S), S 2024-02-08 reported favorably, 1st reading, to Calendar with Committee Substitute (1), S 2024-02-09 2nd reading, to Rules, S 2024-02-09 floor amendment (1) filed to Committee Substitute, S 2024-02-12 posted for passage in the Regular Orders of the Day for Tuesday, February 13, 2024, S 2024-02-13 3rd reading, S 2024-02-13 Floor Amendment (1) defeated, S 2024-02-13 passed 26-7 with Committee Substitute (1), H 2024-02-14 received in House, H 2024-02-14 to Committee on Committees (H), H 2024-03-07 to Education (H), H 2024-03-12 taken from Education (H), H 2024-03-12 1st reading, H 2024-03-12 returned to Education (H), H 2024-03-13 taken from Education (H), H 2024-03-13 2nd reading, H 2024-03-13 returned to Education (H), H 2024-03-14 reported favorably, to Rules with Committee Substitute (1), H 2024-03-14 floor amendments (1), (2), (3), (4), (5), (6), (7) and (8) filed to Committee Substitute, H 2024-03-14 taken from Rules, H 2024-03-14 placed in the Orders of the Day, H 2024-03-15 floor amendment (9) filed to Committee Substitute, H 2024-03-15 3rd reading, H 2024-03-15 floor amendments (1) (2) (3) (4) (5) (6) (7) and (8) defeated, H 2024-03-15 passed 68-18 with Committee Substitute (1), S 2024-03-15 received in Senate, S 2024-03-15 to Rules (S), S 2024-04-12 posted for passage for concurrence in House Committee Substitute (1)",Failed,4e86048166d4d333a4eceb44e709fd55,1795577,"https://apps.legislature.ky.gov/recorddocuments/bill/24RS/sb6/orig_bill.pdf, https://apps.legislature.ky.gov/recorddocuments/bill/24RS/sb6/bill.pdf",,https://drive.google.com/open?id=1uIHFahh38u7nWeWeD1DI5gJTqjw7I1lj
Kentucky,SB93,AN ACT relating to education.,DEI Ban,1/11/2024,to Education (S),Worst,Moderate,,https://legiscan.com/KY/bill/SB93/2024,"Stephen Meredith, Gary Boswell, Donald Douglas, Lindsey Tichenor",,"S 2024-01-08 introduced in Senate, S 2024-01-08 to Committee on Committees (S), S 2024-01-11 to Education (S)",Failed,b4f3fd6f7e263c4595cff797fd7a9506,1800438,https://apps.legislature.ky.gov/recorddocuments/bill/24RS/sb93/orig_bill.pdf,,https://drive.google.com/open?id=1wwl3MPLDPx-W_X2fr1XU1sYT1FVu97TC
Louisiana,HB121,Provides relative to the use of certain names and pronouns for students,Pronoun Ban,6/19/2024,Effective date: 08/01/2024.,Worst,Worst,"""The Given Name Act"" says that it's ok for school employees and students to not use a person's pronouns or name if they don't align with their birth certificate & gamete sex, and that parents can require the schools to misgender their trans kids.",https://legiscan.com/LA/bill/HB121/2024,"Raymond Crews, Beryl Amedee, Kathy Edmonston, Gabe Firment, Danny McCormick, Rodney Schamerhorn",Hearing 2024-04-10 12:00 Room 1,"H 2024-02-22 Prefiled., H 2024-02-22 Under the rules, provisionally referred to the Committee on Education., H 2024-02-23 First appeared in the Interim Calendar on 2/23/2024., H 2024-03-11 Read by title, under the rules, referred to the Committee on Education., H 2024-04-10 Reported with amendments (9-3)., H 2024-04-11 Read by title, amended, ordered engrossed, passed to 3rd reading., H 2024-04-11 Scheduled for floor debate on 04/16/2024., H 2024-04-16 Read third time by title, amended, roll called on final passage, yeas 69, nays 29. Finally passed, title adopted, ordered to the Senate., S 2024-04-17 Received in the Senate. Read first time by title and placed on the Calendar for a second reading.",Enacted,c7f6a45efab356098be20ce3fbc7b4fe,1852582,"https://www.legis.la.gov/Legis/ViewDocument.aspx?d=1345060, https://www.legis.la.gov/Legis/ViewDocument.aspx?d=1364469, https://www.legis.la.gov/Legis/ViewDocument.aspx?d=1366386",,https://drive.google.com/open?id=1mk286wTcBNyOE9W_CWYh2qrfi0etZM2Y
Louisiana,HB122,Provides relative to discussion of sexual orientation and gender identity in public schools,Don't Say Gay,6/19/2024,Effective date: 08/01/2024.,Worst,Worst,"Prohibits in K12, discussion of or instruction about sexual orientation or gender identity either during the regular school day, or during extracurriculars - effectively banning Gender & Sexuality Alliance clubs.",https://legiscan.com/LA/bill/HB122/2024,"Dodie Horton, Beryl Amedee, Raymond Crews, Kathy Edmonston, Danny McCormick",Hearing 2024-04-10 12:00 Room 1,"H 2024-02-22 Prefiled., H 2024-02-22 Under the rules, provisionally referred to the Committee on Education., H 2024-02-23 First appeared in the Interim Calendar on 2/23/2024., H 2024-03-11 Read by title, under the rules, referred to the Committee on Education., H 2024-04-10 Reported favorably (9-3)., H 2024-04-11 Read by title, ordered engrossed, passed to 3rd reading., H 2024-04-11 Scheduled for floor debate on 04/16/2024., H 2024-04-16 Read third time by title, amended, roll called on final passage, yeas 69, nays 28. Finally passed, title adopted, ordered to the Senate., S 2024-04-17 Received in the Senate. Read first time by title and placed on the Calendar for a second reading.",Enacted,6618296d1c553b1c4174f5417c52244e,1852530,"https://www.legis.la.gov/Legis/ViewDocument.aspx?d=1345061, https://www.legis.la.gov/Legis/ViewDocument.aspx?d=1364420, https://www.legis.la.gov/Legis/ViewDocument.aspx?d=1366197",,https://drive.google.com/open?id=1VwiUIfHxt5u-xXdFirOt0PrLhaSRLja-
Louisiana,HB425,"Provision of sexual content to minor, prohibited; libraries prohibited from purchasing certain sexual content; certain entities prohibited from affiliating with American Library Assn.; cause of action, created; exception to Anti-Obscenity Enforcement Act for libraries and library employees, repealed",Book Ban,4/4/2024,Pending House Judiciary,Worst,Worst,"defines ""gender ideology"" as sexual content and bans libraries from giving access to it to minors; failed to advance before sine die 5/9/2024",https://legiscan.com/AL/bill/HB425/2024,,,,Failed,,,,,
Louisiana,HB545,Provides relative to certain materials in public school libraries,Book Ban,5/7/2024,"Read by title, returned to the calendar.",Worst,Worst,Passed a committee in the House but failed at sine die on 6/3/2024,https://legiscan.com/LA/bill/HB545/2024,Beryl Amedee,Hearing 2024-04-16 09:30 Room 6,"H 2024-03-01 Prefiled., H 2024-03-01 Under the rules, provisionally referred to the Committee on Administration of Criminal Justice., H 2024-03-11 Read by title, under the rules, referred to the Committee on Administration of Criminal Justice., H 2024-04-16 Reported favorably (8-4)., H 2024-04-17 Read by title, ordered engrossed, passed to 3rd reading., H 2024-04-18 Scheduled for floor debate on 04/22/2024.",Failed,a9068dc615adf12db572fa16cd3a54c3,1857939,"https://www.legis.la.gov/Legis/ViewDocument.aspx?d=1351530, https://www.legis.la.gov/Legis/ViewDocument.aspx?d=1365837",,https://drive.google.com/open?id=1mCuLbEGEFEydDpfDe7UMROzGy48lnlpC
Louisiana,HB608,Creates the Women's Safety and Protection Act (RE SEE FISC NOTE GF EX See Note),End Legal Recognition/ Trans Bathroom Ban/ Prison Placement Ban,6/3/2024,Effective date: 08/01/2024.,Worst,Worst,"Uses IWF and WoLF's ""Women's Bill of Rights"" Language",https://legiscan.com/LA/bill/HB608/2024,"Roger Wilder, Beryl Amedee, Tony Bacala, Dennis Bamburg, Mike Bayham, Beau Beaullieu, Stephanie Berault, Beth Billings, Ryan Bourriaque, Chad Boyer, Rhonda Butler, Josh Carlson, Dewith Carrier, Kim Carver, Emily Chenevert, Kimberly Coates, Vincent Cox, Raymond Crews, Daryl Deshotel, Jason DeWitt, Kellee Dickerson, Jessica Domangue, Michael Echols, Kathy Edmonston, Peter Egan, Julie Emerson, Les Farnum, Gabe Firment, Bryan Fontenot, Foy Gadberry, Jay Galle, Brett Geymann, Brian Glorioso, Troy Hebert, Dodie Horton, John Illg, Mike Johnson, Travis Johnson, Timothy Kerner, Jacob Landry, Shane Mack, Danny McCormick, Jack McFarland, Joseph Orgeron, Charles Owen, Neil Riser, Troy Romero, Rodney Schamerhorn, Laurie Schlegel, Vincent St. Blanc, Phillip Tarver, Polly Thomas, Francis Thompson, Christopher Turner, Lauren Ventrella, Debbie Villio, Jeff Wiley, John Wyble, Adam Bass, Heather Cloud, Rick Edmonds, Michael Fesi, Valarie Hodges, Caleb Kleinpeter, Blake Miguez, Beth Mizell, Alan Seabaugh, Jeremy Stine",Hearing 2024-04-08 09:00 Room 4,"H 2024-03-01 Prefiled., H 2024-03-01 Under the rules, provisionally referred to the Committee on Civil Law and Procedure., H 2024-03-11 Read by title, under the rules, referred to the Committee on Civil Law and Procedure., H 2024-04-08 Reported with amendments (10-0-1)., H 2024-04-09 Read by title, amended, ordered engrossed, passed to 3rd reading., H 2024-04-09 Scheduled for floor debate on 04/11/2024., H 2024-04-11 Read third time by title, amended, roll called on final passage, yeas 80, nays 17. Finally passed, title adopted, ordered to the Senate., S 2024-04-15 Received in the Senate. Read first time by title and placed on the Calendar for a second reading., S 2024-04-16 Read second time by title and referred to the Committee on Judiciary C.",Enacted,6dc0a7792f63ebd7979922700c2d8c61,1858461,"https://www.legis.la.gov/Legis/ViewDocument.aspx?d=1352172, https://www.legis.la.gov/Legis/ViewDocument.aspx?d=1363440, https://www.legis.la.gov/Legis/ViewDocument.aspx?d=1364962",,https://drive.google.com/open?id=1z6OQCEt_1gwn6dHabgk5mqTQTDgOX4P_
Louisiana,SB5,Requires fiduciaries for public retirement systems to make investment decisions based solely on financial factors. (8/1/24) (OR SEE ACTUARIAL NOTE APV),Ban On Public Investment in ESG Funds,3/11/2024,Introduced in the Senate; read by title. Rules suspended. Read second time and referred to the Committee on Retirement.,Worst,Worst,Failed at sine die on 6/3/2024,https://legiscan.com/LA/bill/SB5/2024,Blake Miguez,"Hearing 2024-02-20 09:00 Room A-B, Hearing 2024-02-21 09:00 Room A-B, Hearing 2024-02-26 10:00 Room 6, Hearing 2024-03-18 01:00 Room E, Hearing 2024-03-18 13:00 Room E, Hearing 2024-03-25 01:00 Room E, Hearing 2024-04-02 02:00 Room E","S 2024-01-25 Prefiled and under the rules provisionally referred to the Committee on Retirement., S 2024-03-11 Introduced in the Senate; read by title. Rules suspended. Read second time and referred to the Committee on Retirement.",Failed,e4542a6d1307f4b7173627e579888d57,1828830,https://www.legis.la.gov/Legis/ViewDocument.aspx?d=1341361,,https://drive.google.com/open?id=1ZuiJFUqVN8_pNgw52C9kqT1k9Rb1P_he
Maryland,HB1311,Criminal Law - Obscene Material - Device Filters,Online Obscenity Law,2/9/2024,Hearing 3/05 at 1:00 p.m.,Safest,Safest,,https://legiscan.com/MD/bill/HB1311/2024,Susan McComas,Hearing 2024-03-05 13:00 ,"H 2024-02-09 First Reading Economic Matters, H 2024-02-09 Hearing 3/05 at 1:00 p.m.",Failed,8db06c55d8210bc72e35dbddaf950e18,1842134,https://mgaleg.maryland.gov/2024RS/bills/hb/hb1311f.pdf,,https://drive.google.com/open?id=10pr67hHbDKL8JeL8vk3ra1vXmNau2gGJ
Maryland,HB25,Public Schools - Sexually Explicit Materials - Prohibited in Libraries and Media Centers,Book Ban,2/19/2024,Unfavorable Report by Ways and Means,Safest,Safest,,https://legiscan.com/MD/bill/HB25/2024,Nino Mangione,Hearing 2024-01-31 13:00 ,"H 2023-08-28 Pre-filed, H 2024-01-10 First Reading Ways and Means, H 2024-01-16 Hearing 1/31 at 1:00 p.m., H 2024-02-19 Unfavorable Report by Ways and Means",Failed,8390af30a0a627a696fa634e59d835b5,1798393,https://mgaleg.maryland.gov/2024RS/bills/hb/hb0025f.pdf,,https://drive.google.com/open?id=1A9OkZ4ibVOETexPmkxbx0oaMiii0jZ1t
Maryland,HB47,Education - Interscholastic and Intramural Junior Varsity and Varsity Teams - Designation Based on Sex (Fairness In Girls' Sports Act),Sports Ban,2/12/2024,Unfavorable Report by Ways and Means,Safest,Safest,,https://legiscan.com/MD/bill/HB47/2024,"Kathy Szeliga, Lauren Arikan, Brian Chisholm, Mark Fisher, Robin Grammer, Tom Hutchinson, Nicholaus Kipke, Bob Long, Nino Mangione, Susan McComas, April Fleming Miller, Matt Morgan, Todd Morgan, Rachel Munoz, Ryan Nawrocki, Stuart Schmidt, Chris Tomlinson",Hearing 2024-01-31 13:00 ,"H 2023-10-24 Pre-filed, H 2024-01-10 First Reading Ways and Means, H 2024-01-16 Hearing 1/31 at 1:00 p.m., H 2024-02-12 Unfavorable Report by Ways and Means",Failed,88fdeb009a03817323532d1f8ac6b808,1798108,https://mgaleg.maryland.gov/2024RS/bills/hb/hb0047f.pdf,,https://drive.google.com/open?id=14SrL9MK-gX_FeRreQ8K8-j-_sSRoSY9Q
Maryland,HB671,Criminal Law - Display of Obscene Material to Minors - Prohibition,Book Ban,1/31/2024,Hearing 2/14 at 1:00 p.m.,Safest,Safest,,https://legiscan.com/MD/bill/HB671/2024,"Robin Grammer, Lauren Arikan, Brian Chisholm, Mark Fisher, Nicholaus Kipke, Matt Morgan, Ryan Nawrocki, Kathy Szeliga",Hearing 2024-02-14 13:00 ,"H 2024-01-25 First Reading Ways and Means, H 2024-01-31 Hearing 2/14 at 1:00 p.m.",Failed,8947eac1afb97c8796443b187d631c7a,1827883,https://mgaleg.maryland.gov/2024RS/bills/hb/hb0671f.pdf,,https://drive.google.com/open?id=1ifjLDX7Qhi6_KSqY6eH1t8WAVaWzZEAa
Maryland,HB672,Criminal Law - Display of Obscene Materials to Minors - Age Verification,Online Obscenity Law,1/29/2024,Hearing 2/20 at 1:00 p.m.,Safest,Safest,,https://legiscan.com/MD/bill/HB672/2024,"Robin Grammer, Lauren Arikan, Brian Chisholm, Mark Fisher, Nicholaus Kipke, Matt Morgan, Ryan Nawrocki, Kathy Szeliga",Hearing 2024-02-20 13:00 ,"H 2024-01-25 First Reading Economic Matters, H 2024-01-29 Hearing 1/29 at 1:00 p.m., H 2024-01-29 Hearing canceled, H 2024-01-29 Hearing 2/20 at 1:00 p.m.",Failed,6dacea2838f4b5f2848f91d46d616482,1827884,https://mgaleg.maryland.gov/2024RS/bills/hb/hb0672f.pdf,,https://drive.google.com/open?id=1Xzopp6u7rChvgPBEq4bSXeQOS32BPtEY
Maryland,HB722,Health – Minors – Gender and Sex Transition Procedures,Gender Affirming Care Ban,2/7/2024,Hearing 2/21 at 1:00 p.m.,Safest,Safest,A Vulnerable Child Protection Act,https://legiscan.com/MD/bill/HB722/2024,"Lauren Arikan, Christopher Adams, Brian Chisholm, Mark Fisher, Jeff Ghrist, Robin Grammer, Wayne Hartman, Nicholaus Kipke, Nino Mangione, Matt Morgan, Ryan Nawrocki, Jesse Pippy, Teresa Reilly, Sheree Sample-Hughes, Gary Simmons, Kathy Szeliga, Kym Taylor, William Valentine, William Wivell",Hearing 2024-02-21 13:00 ,"H 2024-01-26 First Reading Health and Government Operations, H 2024-02-07 Hearing 2/21 at 1:00 p.m.",Failed,5d4cd2e0c454237261d8b2840365c668,1829181,https://mgaleg.maryland.gov/2024RS/bills/hb/hb0722f.pdf,,https://drive.google.com/open?id=1qcimRYcjVbLWHKsR8OTyQwvzoLTZW9SC
Maryland,HB772,Internet–Connected Devices and Internet Service Providers – Default Filtering of Obscene Content (Maryland Online Child Protection Act),Online Obscenity Law,2/2/2024,Hearing 2/20 at 1:00 p.m.,Safest,Safest,,https://legiscan.com/MD/bill/HB772/2024,Shaneka Henson,Hearing 2024-02-20 13:00 ,"H 2024-01-31 First Reading Economic Matters, H 2024-02-01 Hearing 2/13 at 1:00 p.m., H 2024-02-02 Hearing canceled, H 2024-02-02 Hearing 2/20 at 1:00 p.m.",Failed,88921d8d4bf6b5d7610d98c3719b32d4,1832665,https://mgaleg.maryland.gov/2024RS/bills/hb/hb0772f.pdf,,https://drive.google.com/open?id=1QB-3_Ar2gkWtoclFD8O61_i34WAVHHXM
Maryland,SB355,Criminal Law - Display of Obscene Material to Minors - Prohibition,Book Ban,1/30/2024,Hearing 2/02 at 10:30 a.m.,Safest,Safest,,https://legiscan.com/MD/bill/SB355/2024,Johnny Salling,Hearing 2024-02-02 10:30 ,"S 2024-01-16 First Reading Judicial Proceedings, S 2024-01-19 Hearing 2/02 at 1:00 p.m., S 2024-01-30 Hearing canceled, S 2024-01-30 Hearing 2/02 at 10:30 a.m.",Failed,a1b31fccc9bd1059f4bb100cd1dea59c,1813615,https://mgaleg.maryland.gov/2024RS/bills/sb/sb0355f.pdf,,https://drive.google.com/open?id=1ki1wuxTLwu_WiTN6MYSkLSIpl5V-G4pH
Maryland,SB381,Education - Interscholastic and Intramural Junior Varsity and Varsity Teams - Designation Based on Sex (Fairness In Girls' Sports Act),Sports Ban,1/25/2024,Hearing 2/07 at 2:00 p.m.,Safest,Safest,,https://legiscan.com/MD/bill/SB381/2024,"Mary Carozza, Jack Bailey, Paul Corderman, J.B. Jennings, Stephen Hershey, Johnny Mautz, Justin Ready, Chris West, Johnny Salling, William Folden, Mike McKay, Jason Gallion, Bryan Simonaire",Hearing 2024-02-07 14:00 ,"S 2024-01-17 First Reading Education, Energy, and the Environment, S 2024-01-24 Hearing 2/07 at 1:00 p.m., S 2024-01-25 Hearing canceled, S 2024-01-25 Hearing 2/07 at 2:00 p.m.",Failed,0dbb7295e0fe0df7649ae0aab54f3679,1817779,https://mgaleg.maryland.gov/2024RS/bills/sb/sb0381f.pdf,,https://drive.google.com/open?id=1mwimSkfizDcKxptouxg6iIpmKWS3LGVS
Maryland,SB780,Internet-Connected Devices and Internet Service Providers - Default Filtering of Obscene Content (Maryland Online Child Protection Act),Online Obscenity Law,2/6/2024,Hearing 3/13 at 1:00 p.m.,Safest,Safest,,https://legiscan.com/MD/bill/SB780/2024,Anthony Muse,Hearing 2024-03-13 13:00 ,"S 2024-02-01 First Reading Finance, S 2024-02-06 Hearing 3/13 at 1:00 p.m.",Failed,8340c668f43c0e86e235a8465a0fe193,1834352,https://mgaleg.maryland.gov/2024RS/bills/sb/sb0780f.pdf,,https://drive.google.com/open?id=16bkp_y_sQ3kC3bXlyZJEOrnUHL_K3oo_
Massachusetts,H458,Relative to parental rights in education,Don't Say Gay/Forced Outing By Schools,5/20/2024,"Accompanied a study order, see H4583",Safest,Safest,Carried over from 2023,https://legiscan.com/MA/bill/H458/2023,"David DeCoste, Colleen Garry, Kelly Pease, Joseph McKenna, Patrick O'Connor",Hearing 2023-07-17 11:00 Gardner Auditorium,"H 2023-02-16 Referred to the Joint Committee on Education, S 2023-02-16 Senate concurred, J 2023-07-06 Hearing scheduled for 07/17/2023 from 11:00 AM-05:00 PM in Gardner Auditorium",Failed,7f30baa34dfb4de683da4d50be43bc22,1738528,https://malegislature.gov/Bills/193/H458.pdf,,
Massachusetts,H4583,,Don't Say Gay/Forced Outing By Schools,5/20/2024,Discharged to the committee on House Rules,Safest,Safest,Omnibus study order includes replacing H458,https://legiscan.com/MA/bill/H4583/2023,,,,,,,,,
Michigan,HB5831,Corrections: other; strip searches according to biological sex by MDOC facilities; require. Amends sec. 69a of 1953 PA 232 (MCL 791.269a).,Prison Placement Ban,6/26/2024,Bill Electronically Reproduced 06/26/2024,Low,Low,"Strip searches conducted by MDOC to be conducted on the basis of ""biological sex""",https://legiscan.com/MI/bill/HB5831/2023,,,,,,,,,
