State,Number,Summary,Bill Type,Date,Status,Youth State Risk,Adult State Risk,Notes,URL,Sponsors,Calendar,History,Manual Status,Change Hash,Bill ID,PDF,Bill Analysis (AI Automated),Bill PDF
Alabama,HB111,"Sex-based terms, defined;  vital statistics, report sex as male or female at birth required, legislative policy regarding sex and gender identity established",End Legal Recognition,4/23/2024,Read for the Second Time and placed on the Calendar,Worst,Worst,"Uses IWF and WoLF's ""Women's Bill of Rights"" language",https://legiscan.com/AL/bill/HB111/2024,Susan DuBose,"Hearing 2024-02-21 13:30 Room 200, Hearing 2024-02-28 13:30 Room 200","H 2024-02-06 Read for the first time and referred to the House Committee on Judiciary, H 2024-02-06 Pending House Judiciary, H 2024-02-28 Reported Out of Committee House of Origin, H 2024-02-28 Committee Amendment Adopted 47JLI33-1, H 2024-02-28 Committee Amendment Adopted W48S559-1, H 2024-02-28 Committee Engrossed Substitute Adopted 7L7PE2E-1, H 2024-02-28 Read for the Second Time and placed on the Calendar, H 2024-04-11 Third Reading in House of Origin, H 2024-04-11 Judiciary  Engrossed Substitute Offered 7L7PE2E-1, H 2024-04-11 Motion to Adopt - Adopted Roll Call 514 7L7PE2E-1, H 2024-04-11 Carried Over to the Call of the Chair, H 2024-04-11 Judiciary 1st Amendment Offered 47JLI33-1, H 2024-04-11 Judiciary 2nd Amendment Offered W48S559-1, H 2024-04-11 Rafferty 1st Amendment Offered J6C1FNF-1, H 2024-04-11 Motion to Adopt - Adopted Roll Call 522 J6C1FNF-1, H 2024-04-11 Stadthagen 1st Amendment Offered FZ94CC5-1, H 2024-04-11 Motion to Read a Third Time and Pass as Amended - Adopted Roll Call 523, H 2024-04-11 Engrossed, S 2024-04-16 Read for the first time and referred to the Senate Committee on County and Municipal Government, S 2024-04-16 Pending Senate County and Municipal Government",Failed,5a62a592eb85f81158d0550d3eb938a5,1838621,"https://www.legislature.state.al.us/pdf/SearchableInstruments/2024RS/HB111-int.pdf, https://www.legislature.state.al.us/pdf/SearchableInstruments/2024RS/HB111-eng.pdf",,https://drive.google.com/open?id=1BTppJ8TUEUAY2Tz9iT7XrcojNXwC84IH
Alabama,HB4,"Crimes and offenses, further provides for obscenity crimes",Book Ban,7/8/2024,Pending House Judiciary,Worst,Worst,"Prefiled for 2025 session; re: K12 & public libraries, re: ""sexual or gender-oriented content""",https://legiscan.com/AL/bill/HB4/2025,,,,Roll Over,,,,,
Alabama,HB130,"Education, instruction about gender identity and sexual orientation in public K-12 schools, prohibited",Don't Say Gay Expansion,5/2/2024,Read for the Second Time and placed on the Calendar,Worst,Worst,complete ban up to 12th grade,https://legiscan.com/AL/bill/HB130/2024,Mack Butler,"Hearing 2024-03-06 13:30 Room 206, Hearing 2024-03-20 13:30 Room 206","H 2024-02-07 Read for the first time and referred to the House Committee on Education Policy, H 2024-02-07 Pending House Education Policy, H 2024-03-20 Education Policy 1st Amendment EX7EC2C-1, H 2024-03-20 Reported Out of Committee House of Origin from House Education Policy YUXP22N-1, H 2024-03-21 Read for the Second Time and placed on the Calendar",Failed,d53c58b7b3378898787e527d624fde66,1839515,https://www.legislature.state.al.us/pdf/SearchableInstruments/2024RS/HB130-int.pdf,,https://drive.google.com/open?id=1UzKr3cDOPU-hhsxr3xr4a86TllDJV94Q
Alabama,HB164,"Consumer Protection; online distribution of material harmful to minors, prohibited; online age-verification requirements, required",Online Obscenity Law,4/24/2024,Enacted,Worst,Worst,,https://legiscan.com/AL/bill/HB164/2024,Ben Robbins,"Hearing 2024-02-21 13:30 Room 200, Hearing 2024-03-20 08:30 Room 325","H 2024-02-14 Read for the first time and referred to the House Committee on Judiciary, H 2024-02-14 Pending House Judiciary, H 2024-02-21 Reported Out of Committee House of Origin, H 2024-02-21 Committee Amendment Adopted VEYMPLL-1, H 2024-02-22 Read for the Second Time and placed on the Calendar, H 2024-02-21 Committee Amendment Adopted CUIKJJJ-1, H 2024-02-21 Committee Amendment Adopted W42KE9E-1, H 2024-02-21 Committee Amendment Adopted TVUY995-1, H 2024-02-21 Committee Engrossed Substitute Adopted 25GWSSK-1, H 2024-02-29 Third Reading in House of Origin, H 2024-02-29 JUDY Reported Substitute Offered from House Judiciary 25GWSSK-1, H 2024-02-29 Motion to Adopt - Adopted Roll Call 162 25GWSSK-1, H 2024-02-29 Motion to Read a Third Time and Pass as Amended - Adopted Roll Call 163, H 2024-02-29 Engrossed, S 2024-03-06 Read for the first time and referred to the Senate Committee on Judiciary, S 2024-03-06 Pending Senate Judiciary, S 2024-03-20 Judiciary 1st Amendment IDU2WWZ-1, S 2024-03-20 Reported Out of Committee Second House, S 2024-03-21 Read for the Second Time and placed on the Calendar, S 2024-04-09 Third Reading in Second House, S 2024-04-09 Judiciary 1st Amendment Offered IDU2WWZ-1, S 2024-04-09 Livingston motion to Adopt - Adopted Roll Call 378 IDU2WWZ-1, S 2024-04-09 Motion to Read a Third Time and Pass as Amended - Adopted Roll Call 379, H 2024-04-11 Ready to Enroll, H 2024-04-11 Ready to Enroll, H 2024-04-11 Enrolled, H 2024-04-11 Enrolled, H 2024-04-16 Delivered to Governor, S 2024-04-16 Signature Requested",Enacted,741891759bc2063ba90929a5b6be2023,1846509,"https://www.legislature.state.al.us/pdf/SearchableInstruments/2024RS/HB164-int.pdf, https://www.legislature.state.al.us/pdf/SearchableInstruments/2024RS/HB164-eng.pdf, https://www.legislature.state.al.us/pdf/SearchableInstruments/2024RS/HB164-enr.pdf",,https://drive.google.com/open?id=1god4bODWxmQYbVA_AOYusF8vLmLNzJ0c
Alabama,HB167,"Consumer protection; filter requirements on Internet enabled devices, penalties for violation",Online Obscenity Law,5/7/2024,Read for the Second Time and placed on the Calendar,Worst,Worst,,https://legiscan.com/AL/bill/HB167/2024,Chris Sells,"Hearing 2024-03-06 15:00 Room 418, Hearing 2024-03-06 15:00 Room 418 UPDATED AGENDA","H 2024-02-14 Read for the first time and referred to the House Committee on Judiciary, H 2024-02-14 Pending House Judiciary, H 2024-02-15 Re-referred to Committee in House of Origin to House Commerce and Small Business, H 2024-03-06 Reported Out of Committee House of Origin, H 2024-03-06 Read for the Second Time and placed on the Calendar, H 2024-04-04 Third Reading in House of Origin, H 2024-04-04 Motion to Read a Third Time and Pass - Adopted Roll Call 388, S 2024-04-09 Read for the first time and referred to the Senate Committee on Fiscal Responsibility and Economic Development, S 2024-04-09 Pending Senate Fiscal Responsibility and Economic Development",Failed,ff90e16338864dce71e75783f3964655,1847116,https://www.legislature.state.al.us/pdf/SearchableInstruments/2024RS/HB167-int.pdf,,https://drive.google.com/open?id=1tcwtNRRI9sRrsvWSyKc452gPyWr_4XFl
Alabama,HB385,"Crimes and offenses, provided that the use of any premises to distribute material that is harmful to minors is a public nuisance and further provided for the definition of ""sexual conduct""",Drag Ban,5/2/2024,Read for the Second Time and placed on the Calendar,Worst,Worst,,https://legiscan.com/AL/bill/HB385/2024,Arnold Mooney,Hearing 2024-04-03 15:00 Room 206,"H 2024-04-02 Read for the first time and referred to the House Committee on State Government, H 2024-04-02 Pending House State Government, H 2024-04-03 Reported Out of Committee House of Origin, H 2024-04-04 Read for the Second Time and placed on the Calendar",Failed,1d2d3dac40b6d67e5eb31c818fbd797d,1869744,https://www.legislature.state.al.us/pdf/SearchableInstruments/2024RS/HB385-int.pdf,,https://drive.google.com/open?id=1vEbU6n2WfBAQBgmpFqZczTxTCOzrFRMu
Alabama,HB425,"Provision of sexual content to minor, prohibited; libraries prohibited from purchasing certain sexual content; certain entities prohibited from affiliating with American Library Assn.; cause of action, created; exception to Anti-Obscenity Enforcement Act for libraries and library employees, repealed",Book Ban,4/4/2024,Pending House Judiciary,Worst,Worst,"defines ""gender ideology"" as sexual content and bans libraries from giving access to it to minors",https://legiscan.com/AL/bill/HB425/2024,,,,Failed,,,,,
Alabama,SB129,"Diversity, equity, and inclusion; certain public entities prohibited from maintaining office that promotes diversity, equity, and inclusion programs; certain programs related to divisive concepts or diversity, equity, and inclusion, prohibited; promotion and endorsement of certain divisive concepts in certain public settings prohibited; exceptions provided; public institution of higher education, required to designate multioccupancy restrooms based on biological sex",DEI Ban / Trans Bathroom Ban,3/20/2024,Enacted,Worst,Worst,"No DEI for state agencies, public schools, or public institutions of higher learning.  Also, ""each public institution of higher education shall ensure that every multiple occupancy restroom be designated for use of individuals based on their biological sex""",https://legiscan.com/AL/bill/SB129/2024,Will Barfoot,"Hearing 2024-02-21 11:00 Finance and Taxation, Hearing 2024-03-05 10:00 Room 617","S 2024-02-20 Read for the first time and referred to the Senate Committee on County and Municipal Government, S 2024-02-20 Pending Senate County and Municipal Government, S 2024-02-21 Reported Out of Committee House of Origin, S 2024-02-21 Read for the Second Time and placed on the Calendar, S 2024-02-21 Committee Amendment Adopted Q63R151-1, S 2024-02-22 Third Reading in House of Origin, S 2024-02-22 C&MG Amendment Offered Q63R151-1, S 2024-02-22 Barfoot motion to Adopt - Adopted Roll Call 63 Q63R151-1, S 2024-02-22 Singleton Amendment Offered ITHK6W6-1, S 2024-02-22 Singleton motion to Adopt - Adopted Roll Call 64 ITHK6W6-1, S 2024-02-22 Singleton 2nd Amendment Offered 36SKVZZ-1, S 2024-02-22 Singleton motion to Adopt - Adopted Roll Call 65 36SKVZZ-1, S 2024-02-22 Coleman 2nd Amendment Offered 7LAF22E-1, S 2024-02-22 Coleman motion to Adopt - Lost Roll Call 66 7LAF22E-1, S 2024-02-22 Hatcher Amendment Offered Q6WJ144-1, S 2024-02-22 Hatcher motion to Adopt - Lost Roll Call 67 Q6WJ144-1, S 2024-02-22 Coleman-Madison Amendment Offered MVQMW11-1, S 2024-02-22 Coleman-Madison motion to Adopt - Adopted Roll Call 68 MVQMW11-1, S 2024-02-22 Motion to Read a Third Time and Pass as Amended - Adopted Roll Call 69, S 2024-02-22 Engrossed, S 2024-02-27 Engrossed, H 2024-02-27 Read for the first time and referred to the House Committee on State Government, H 2024-02-27 Pending House State Government, H 2024-03-05 Reported Out of Committee Second House, H 2024-03-05 Read for the Second Time and placed on the Calendar, H 2024-03-05 Committee Amendment Adopted MNZAWH1-1, H 2024-03-05 Committee Amendment Adopted TE8M511-1, H 2024-03-05 Committee Engrossed Substitute Adopted 48A1R3R-1, H 2024-03-07 Third Reading in Second House, H 2024-03-07 SG Reported Substitute Offered from House State Government 48A1R3R-1, H 2024-03-07 Motion to Adopt - Adopted Roll Call 219 48A1R3R-1, H 2024-03-07 Chestnut Amendment Offered JMGLFYF-1, H 2024-03-07 Motion to Adopt - Adopted Roll Call 220 JMGLFYF-1, H 2024-03-07 Motion to Read a Third Time and Pass as Amended - Adopted Roll Call 222, S 2024-03-19 Barfoot Motion to Concur - Adopted, S 2024-03-19 Ready to Enroll, S 2024-03-19 Delivered to Governor, H 2024-03-19 Signature Requested, S 2024-03-19 Enrolled, S 2024-03-20 Enacted",Enacted,30b99ca7a0fc91cc20581e584d2ee925,1851391,"https://www.legislature.state.al.us/pdf/SearchableInstruments/2024RS/SB129-int.pdf, https://www.legislature.state.al.us/pdf/SearchableInstruments/2024RS/SB129-eng.pdf, https://www.legislature.state.al.us/pdf/SearchableInstruments/2024RS/SB129-enr.pdf",,https://drive.google.com/open?id=1BK2WEwQ_F3aQWqRXKDriMZ47xXUHYG7V
Alabama,SB4,Flags; provides that the Freedom Flag may be displayed on public property and that displaying an unapproved flag on public property is a misdemeanor,Pride Flag Ban,5/7/2024,Currently Indefinitely Postponed,Worst,Worst,,https://legiscan.com/AL/bill/SB4/2024,Gerald Allen,"Hearing 2024-02-07 13:30 Finance and Taxation, Hearing 2024-02-14 13:30 Finance and Taxation, Hearing 2024-02-28 11:00 Finance and Taxation, Hearing 2024-03-06 12:30 Finance and Taxation","S 2023-09-21 Prefiled, S 2024-03-06 Reported Out of Committee House of Origin, S 2024-03-06 Committee Substitute Adopted H7UF638-1, S 2024-03-06 Read for the Second Time and placed on the Calendar",Failed,9ba9a9d9d8b4ce5f6fde37e25e963b49,1781660,https://www.legislature.state.al.us/pdf/SearchableInstruments/2024RS/SB4-int.pdf,,https://drive.google.com/open?id=1ndpxRX0_C_Z6z6juCqZC6HkzR4EIufo6
Alabama,SB92,"Sex-based terms, defined;  vital statistics, report sex as male or female at birth required, legislative policy regarding sex and gender identity established",End Legal Recognition,5/7/2024,Currently Indefinitely Postponed,Worst,Worst,"Uses IWF and WoLF's ""Women's Bill of Rights"" language",https://legiscan.com/AL/bill/SB92/2024,April Weaver,Hearing 2024-02-20 13:00 Finance and Taxation,"S 2024-02-13 Read for the first time and referred to the Senate Committee on County and Municipal Government, S 2024-02-13 Pending Senate County and Municipal Government, S 2024-02-20 Reported Out of Committee House of Origin, S 2024-02-20 Read for the Second Time and placed on the Calendar, S 2024-02-20  CUKGJQQ-1, S 2024-02-20  CUF9QJJ-1, S 2024-04-18 Third Reading in House of Origin, S 2024-04-18 County and Municipal Government 1st Amendment Offered CUKGJQQ-1, S 2024-04-18 County and Municipal Government 2nd Amendment Offered CUF9QJJ-1, S 2024-04-18 Third Reading in House of Origin, S 2024-04-18 County and Municipal Government 1st Amendment Offered CUKGJQQ-1, S 2024-04-18 County and Municipal Government 2nd Amendment Offered CUF9QJJ-1, S 2024-04-18 Carried Over",Failed,da1704d4dece92ba7654ec3275f20bc9,1845772,https://www.legislature.state.al.us/pdf/SearchableInstruments/2024RS/SB92-int.pdf,,https://drive.google.com/open?id=1c2ZCFx-lhjfl15X9uGhNS4ahYF2iwc9X
Alaska,HB105,Sex/reproduction Education; Schools,Don't Say Gay / Forced Outing By Schools,5/6/2024,REFERRED TO FINANCE,Moderate,Moderate,"In schools; pronouns, sex instruction, grooming, sex trafficking, bathroom safety procedures; K12; Carried over from 2023",https://legiscan.com/AK/bill/HB105/2023,Rules,"Hearing 2023-03-13 08:00 Davis 106, Hearing 2023-03-29 08:00 Davis 106, Hearing 2023-03-30 17:15 Davis 106, Hearing 2023-04-13 17:15 Barnes 124, Hearing 2023-04-24 08:00 Davis 106, Hearing 2023-04-26 08:00 Davis 106, Hearing 2023-04-28 08:00 Davis 106, Hearing 2023-05-01 13:00 Gruenberg 120, Hearing 2024-01-31 13:00 Gruenberg 120, Hearing 2024-04-15 13:00 Gruenberg 120, Hearing 2024-04-17 13:00 Gruenberg 120","H 2023-03-08 READ THE FIRST TIME - REFERRALS, H 2023-03-08 EDC, JUD, H 2023-03-08 FN1: (EED), H 2023-03-08 GOVERNOR'S TRANSMITTAL LETTER, H 2023-04-28 EDC RPT CS(EDC) NEW TITLE 1DP 3DNP 1NR 2AM, H 2023-04-28 DP: PRAX, H 2023-04-28 DNP: HIMSCHOOT, STORY, MCCORMICK, H 2023-04-28 NR: RUFFRIDGE, H 2023-04-28 AM: MCKAY, ALLARD, H 2023-04-28 FN1: (EED), H 2023-04-28 REFERRED TO JUDICIARY",Failed,1c4d0813794c6b406d3161a2e93e7075,1730818,"https://www.akleg.gov/PDF/33/Bills/HB0105A.PDF, https://www.akleg.gov/PDF/33/Bills/HB0105B.PDF",,https://drive.google.com/open?id=1YjIMb-w0VmFepQxfsye24AlfgnZ-A5DV
Alaska,HB174,"An Act restricting fiduciary actions by a fiduciary of a state fund, the Alaska Retirement Management Board, and the Alaska Permanent Fund Corporation Board that have the purpose of furthering social, political, or ideological interests.",Ban on Public Investment in ESG Funds,2/26/2024,COSPONSOR(S): MCKAY,Moderate,Moderate,state money can't invest in pro or anti- gender affirming care,https://legiscan.com/AK/bill/HB174/2023,,,,Failed,,,,,
Alaska,HB183,Designate Sex For School-sponsored Sports,Sports Ban,5/14/2024,REFERRED TO EDUCATION,Moderate,Moderate,"Effectively dead in Senate, but Alaska has an existing trans sports ban by executive branch regulation as of October 2023.  K12, college, trans girls/women. Carry over from 2023",https://legiscan.com/AK/bill/HB183/2023,"Jamie Allard, Thomas McKay","Hearing 2024-03-15 08:00 Davis 106, Hearing 2024-03-25 08:00 Davis 106, Hearing 2024-04-08 13:00 Gruenberg 120, Hearing 2024-04-12 13:00 Gruenberg 120","H 2023-04-28 READ THE FIRST TIME - REFERRALS, H 2023-04-28 EDC, JUD, H 2023-05-11 COSPONSOR(S): MCKAY, H 2024-03-25 EDC RPT 2DP 3DNP 1NR 1AM, H 2024-03-25 DP: MCKAY, ALLARD, H 2024-03-25 DNP: HIMSCHOOT, STORY, MCCORMICK, H 2024-03-25 NR: PRAX, H 2024-03-25 AM: RUFFRIDGE, H 2024-03-25 FN1: ZERO(EED), H 2024-04-15 JUD RPT CS(JUD) 5DP 2DNP, H 2024-04-15 DP: C.JOHNSON, CARPENTER, SUMNER, ALLARD, VANCE, H 2024-04-15 DNP: GRAY, GROH, H 2024-04-15 FN1: ZERO(EED), H 2024-04-15 REFERRED TO RULES",Failed,03deac5ef4c32a19dbf5a547bd2cf8f4,1760038,"https://www.akleg.gov/PDF/33/Bills/HB0183A.PDF, https://www.akleg.gov/PDF/33/Bills/HB0183B.PDF",,https://drive.google.com/open?id=1gTslRC4dgz7mgy9l-4wMRMfKkQ6rDmE4
Alaska,HB338,Phys Lblty: Gender Trans Procedure;minors,Liability Law/Backdoor Ban,4/18/2024,REFERRED TO RULES,Moderate,Moderate,,https://legiscan.com/AK/bill/HB338/2023,Jamie Allard,"Hearing 2024-03-06 13:00 Gruenberg 120, Hearing 2024-03-08 13:00 Gruenberg 120, Hearing 2024-03-25 13:00 Gruenberg 120, Hearing 2024-03-27 13:00 Gruenberg 120, Hearing 2024-04-10 13:00 Gruenberg 120, Hearing 2024-04-15 13:00 Gruenberg 120, Hearing 2024-04-17 13:00 Gruenberg 120","H 2024-02-20 READ THE FIRST TIME - REFERRALS, H 2024-02-20 JUD, H 2024-04-18 JUD RPT 4DP 2DNP 1AM, H 2024-04-18 DP: C.JOHNSON, CARPENTER, SUMNER, ALLARD, H 2024-04-18 DNP: GRAY, GROH, H 2024-04-18 AM: VANCE, H 2024-04-18 FN1: ZERO(GOV/COMBINED), H 2024-04-18 REFERRED TO RULES",Failed,65ce0153b794459a5f895d840b7ed741,1851023,https://www.akleg.gov/PDF/33/Bills/HB0338A.PDF,,https://drive.google.com/open?id=1t3ELJ3BXu_m2ATBj6g2LDgoGdkSTVZ_Y
Alaska,HB382,Education; Parent/teacher Rights,Don't Say Gay / Forced Outing By Schools / Trans Bathroom Ban,2/20/2024,REFERRED TO EDUCATION,Moderate,Moderate,Includes a K12 school trans bathroom ban,https://legiscan.com/AK/bill/HB382/2023,Benjamin Carpenter,,"H 2024-02-20 READ THE FIRST TIME - REFERRALS, H 2024-02-20 EDC, JUD, H 2024-02-20 REFERRED TO EDUCATION",Failed,c68bfa7abd86139cd6d837beba966695,1851103,https://www.akleg.gov/PDF/33/Bills/HB0382A.PDF,,https://drive.google.com/open?id=1aeYR-00q19OWi6ioGMmeF_bMLoOMA1op
Alaska,SB245,Tech Devices: Material Filter For Minors,Online Obscenity Law,2/19/2024,REFERRED TO LABOR & COMMERCE,Moderate,Moderate,,https://legiscan.com/AK/bill/SB245/2023,Jesse Bjorkman,,"S 2024-02-19 READ THE FIRST TIME - REFERRALS, S 2024-02-19 L&C, JUD, S 2024-02-19 REFERRED TO LABOR & COMMERCE",Failed,f8f3d762b382412bcfc52d60df16e524,1850245,https://www.akleg.gov/PDF/33/Bills/SB0245A.PDF,,https://drive.google.com/open?id=1GlpzU_VgA_cmicuOE3gIlduaLxLa6IUb
Arizona,HB2391,Biological sex; standard; review; records,End Legal Recognition,1/22/2024,House read second time,Low,Low,"Uses IWF and WoLF's ""Women's Bill of Rights"" language; Failed crossover deadline 3/22/24",https://legiscan.com/AZ/bill/HB2391/2024,"Alexander Kolodin, John Gillette, Rachel Jones, Barbara Parker",,"H 2024-01-17 Introduced in House and read first time, H 2024-01-17 Assigned to House GOV Committee, H 2024-01-17 Assigned to House RULES Committee, H 2024-01-22 House read second time",Failed,34ee2418b53c42c364d10908e792a1c6,1810216,https://www.azleg.gov/legtext/56leg/2r/bills/hb2391p.htm,,https://drive.google.com/open?id=1VbVjRoyBNvUIA13JTJ6A6CTVZxkgMUG5
Arizona,HB2586,Harmful website content; age verification.,Online Obscenity Law,4/8/2024,Governor Vetoed,Low,Low,,https://legiscan.com/AZ/bill/HB2586/2024,"Tim Dunn, Ben Toma","Hearing 2024-01-31 09:00 HHR 4, Hearing 2024-02-05 13:00 HHR 4, Hearing 2024-03-11 14:00 SHR 2, Hearing 2024-03-18 13:00 Caucus Room 1","H 2024-01-22 Introduced in House and read first time, H 2024-01-22 Assigned to House JUD Committee, H 2024-01-22 Assigned to House RULES Committee, H 2024-01-23 House read second time, H 2024-01-31 House JUD Committee action: Do Pass, voting: (4-3-2-0-0-0), H 2024-02-05 House RULES Committee action: constitutional and in proper form, voting: (9-0-0-0-0-0), H 2024-02-05 House consent calendar, H 2024-02-06 House majority caucus: Do pass, H 2024-02-06 House minority caucus: Do pass, H 2024-02-20 House Committee of the Whole action: Retained on the Calendar, H 2024-02-21 House Committee of the Whole action: Do Pass, H 2024-02-28 House third reading PASSED voting: (32-27-0-0), S 2024-02-28 Transmit to Senate, S 2024-03-04 Introduced in Senate and read first time, S 2024-03-04 Assigned to Senate TTMC Committee, S 2024-03-04 Assigned to Senate RULES Committee, S 2024-03-05 Senate read second time, S 2024-03-11 Senate TTMC Committee action: Do Pass, voting: (4-3-0-0), S 2024-03-18 Senate RULES Committee action: Proper For Consideration, voting: (4-3-0-0), S 2024-03-18 Senate consent calendar, S 2024-03-19 Senate minority caucus: Do pass, S 2024-03-19 Senate majority caucus: Do pass, S 2024-03-26 Senate Committee of the Whole action: Do Pass, S 2024-04-01 Senate third reading PASSED voting: (16-12-2-0), H 2024-04-01 Transmit to House,  2024-04-02 Transmitted to Governor,  2024-04-08 Governor Vetoed",Vetoed,0886e74fc083709ebc005366e9286dfd,1811661,"https://www.azleg.gov/legtext/56leg/2r/bills/hb2586p.htm, https://www.azleg.gov/legtext/56leg/2r/bills/hb2586h.htm",,https://drive.google.com/open?id=1DGdiWj5GUhwVdTxW0cX8fw4LHX3V-hAF
Arizona,HB2655,Public schools; teachers; expressive rights,Legal Discrimination in Education,1/24/2024,House read second time,Low,Low,Allows teachers to bully trans kids; Failed at crossover deadline 3/22/24,https://legiscan.com/AZ/bill/HB2655/2024,"Barbara Parker, Justin Heap, Rachel Jones, Alexander Kolodin, David Marshall, Cory McGarr, Steve Montenegro, Jacqueline Parker, Beverly Pingerelli, Austin Smith, Jake Hoffman, Justine Wadsack",,"H 2024-01-23 Introduced in House and read first time, H 2024-01-23 Assigned to House ED Committee, H 2024-01-23 Assigned to House RULES Committee, H 2024-01-24 House read second time",Failed,d3b95540f38f1a44696f4b05298f4124,1823723,https://www.azleg.gov/legtext/56leg/2r/bills/hb2655p.htm,,https://drive.google.com/open?id=1AaocIvy51mWEGJt1FgCKTySN9qNfXm0U
Arizona,HB2657,Parent's rights; mental; physical health,Don't Say Gay / Forced Outing By Schools,1/24/2024,House read second time,Low,Low,Failed at crossover deadline 3/22/24,https://legiscan.com/AZ/bill/HB2657/2024,"Barbara Parker, Justin Heap, Rachel Jones, Alexander Kolodin, David Marshall, Cory McGarr, Steve Montenegro, Jacqueline Parker, Austin Smith, Jake Hoffman, Justine Wadsack",,"H 2024-01-23 Introduced in House and read first time, H 2024-01-23 Assigned to House ED Committee, H 2024-01-23 Assigned to House RULES Committee, H 2024-01-24 House read second time",Failed,9dbdc94bebde5a13a4d67a145fbd01f3,1823814,https://www.azleg.gov/legtext/56leg/2r/bills/hb2657p.htm,,https://drive.google.com/open?id=10PJn8lTV6jHwr7jZ4eoLat1cWhSffxiQ
Arizona,HB2661,Electronic devices; filters; obscene material,Online Obscenity Law,5/1/2024,Senate Committee of the Whole action: Retained,Low,Low,Passed one chamber but failed at sine die 6/15/24,https://legiscan.com/AZ/bill/HB2661/2024,"Ben Toma, Selina Bliss, Tim Dunn, Travis Grantham","Hearing 2024-01-31 09:00 HHR 4, Hearing 2024-02-05 13:00 HHR 4, Hearing 2024-03-18 14:00 SHR 109, Hearing 2024-03-25 13:00 Caucus Room 1","H 2024-01-29 Introduced in House and read first time, H 2024-01-29 Assigned to House JUD Committee, H 2024-01-29 Assigned to House RULES Committee, H 2024-01-30 House read second time, H 2024-01-31 House JUD Committee action: Do Pass, voting: (5-3-1-0-0-0), H 2024-02-05 House RULES Committee action: constitutional and in proper form, voting: (9-0-0-0-0-0), H 2024-02-05 House consent calendar, H 2024-02-06 House majority caucus: Do pass, H 2024-02-06 House minority caucus: Do pass, H 2024-02-20 House Committee of the Whole action: Retained on the Calendar, H 2024-02-28 House Committee of the Whole action: Do Pass Amended, H 2024-02-29 House third reading PASSED voting: (34-25-0-0), S 2024-02-29 Transmit to Senate, S 2024-03-07 Introduced in Senate and read first time, S 2024-03-07 Assigned to Senate FICO Committee, S 2024-03-07 Assigned to Senate RULES Committee, S 2024-03-11 Senate read second time, S 2024-03-18 Senate FICO Committee action: Do Pass Amended, voting: (4-3-0-0), S 2024-03-25 Senate RULES Committee action: Proper For Consideration, voting: (0-0-0-0), S 2024-03-26 Senate minority caucus: Do pass, S 2024-03-26 Senate majority caucus: Do pass",Failed,7fbe1976cb2eaf9c79050d1ece19e528,1823932,"https://www.azleg.gov/legtext/56leg/2r/bills/hb2661p.htm, https://www.azleg.gov/legtext/56leg/2r/bills/hb2661h.htm",,https://drive.google.com/open?id=1YlSmitWRnw2XWlkFbCIXq-_FuRojr9Qr
