South Carolina,H3616,Defense of Children's Innocence Act,Drag Ban,1/23/2024,Member(s) request name added as sponsor: Bustos,Worst,High,,https://legiscan.com/SC/bill/H3616/2023,"Thomas Beach, Matthew Leber, April Cromer, David O'Neal, Jordan Pace, Rob Harris, Stewart Jones, Josiah Magnuson, Gil Gatch, Davey Hiott, Mark Willis, Phillip Lowe, David Vaughan, Joe White, Jay Kilmartin, Patrick Haddon, James Burns, William Chumley, John Mccravy, Joseph Bustos",,"H 2023-01-11 Introduced and read first time, H 2023-01-11 Referred to Committee on Judiciary, H 2023-01-24 Member(s) request name added as sponsor: Magnuson, H 2023-06-14 Member(s) request name added as sponsor: Gatch, Hiott, Willis, Lowe, Vaughan, White, H 2024-01-09 Member(s) request name added as sponsor: Kilmartin, Haddon, Burns, Chumley, H 2024-01-18 Member(s) request name added as sponsor: McCravy, H 2024-01-23 Member(s) request name added as sponsor: Bustos",Failed,69028d24c1a2f1efc245111e56156df0,1654119,https://www.scstatehouse.gov/sess125_2023-2024/prever/3616_20230111.htm,,https://drive.google.com/open?id=1GkKR-T8QnUmrtuXOGMApav1NwPEgUjU1
South Carolina,H4535,Safety in Private Spaces Act,Trans Bathroom Ban,1/18/2024,Member(s) request name added as sponsor: McCravy,Worst,High,Almost identical to the FL bill that passed -Allison,https://legiscan.com/SC/bill/H4535/2023,"Thomas Beach, Ashley Trantham, Patrick Haddon, James Burns, William Chumley, Roger Nutt, John Mccravy",,"H 2023-11-16 Prefiled, H 2023-11-16 Referred to Committee on Judiciary,  2023-12-20 Scrivener's error corrected, H 2024-01-09 Introduced and read first time, H 2024-01-09 Referred to Committee on Judiciary, H 2024-01-09 Member(s) request name added as sponsor: Haddon, Burns, Chumley, Nutt, H 2024-01-18 Member(s) request name added as sponsor: McCravy",Failed,0152f1a64a6372d21e6b8de6b0075613,1784341,"https://www.scstatehouse.gov/sess125_2023-2024/prever/4535_20231116.htm, https://www.scstatehouse.gov/sess125_2023-2024/prever/4535_20231220.htm",,https://drive.google.com/open?id=1d37jbkJC400CvIsdobs0ipx7b5daxpGf
South Carolina,H4538,South Carolina Student Physical Privacy Act,Trans Bathroom Ban,2/13/2024,"Member(s) request name added as sponsor: Mitchell, Yow, McCabe, Herbkersman",Worst,High,"Yet another iteration of Alliance Defending Freedom's ""Student Physical Privacy Act"", model legislation dating back to December 2014",https://legiscan.com/SC/bill/H4538/2023,"April Cromer, Ashley Trantham, Melissa Oremus, Josiah Magnuson, Thomas Pope, Brandon Guffey, David Vaughan, Jay Kilmartin, Thomas Beach, David O'Neal, Roger Nutt, Patrick Haddon, James Burns, William Chumley, John Mccravy, Jeffrey Johnson, Thomas Brittain, Val Guest, Craig Gagnon, Timothy McGinnis, Kevin Hardee, Carla Schuessler, Frank Atkinson, Jackie Hayes, Heather Crawford, Jordan Pace, Travis Moore, Don Chapman, Cody Mitchell, Richard Yow, Donald McCabe, William Herbkersman",,"H 2023-11-16 Prefiled, H 2023-11-16 Referred to Committee on Judiciary, H 2024-01-09 Introduced and read first time, H 2024-01-09 Referred to Committee on Judiciary, H 2024-01-09 Member(s) request name added as sponsor: Vaughan, Kilmartin, Beach, O'Neal, Nutt, Haddon, Burns, Chumley, H 2024-01-18 Member(s) request name added as sponsor: McCravy, H 2024-02-06 Member(s) request name added as sponsor: J.E.Johnson, Brittain, Guest, Gagnon, McGinnis, Hardee, Schuessler, Atkinson, Hayes, Crawford, Pace, T.Moore, Chapman, H 2024-02-13 Member(s) request name added as sponsor: Mitchell, Yow, McCabe, Herbkersman",Failed,cbd193e0ea992e9d9bd7faf21c3a9d4d,1784420,https://www.scstatehouse.gov/sess125_2023-2024/prever/4538_20231116.htm,,https://drive.google.com/open?id=1-9-nJgGPPZE2z356hQtdO1fJDrf8MbIr
South Carolina,H4540,Children's Default to Safety Act,Online Obscenity Law,1/10/2024,Member(s) request name added as sponsor: Felder,Worst,High,,https://legiscan.com/SC/bill/H4540/2023,"Brandon Guffey, Ashley Trantham, Thomas Pope, Patricia Henegan, Bill Taylor, Melissa Oremus, Raye Felder",,"H 2023-11-16 Prefiled, H 2023-11-16 Referred to Committee on Judiciary, H 2024-01-09 Introduced and read first time, H 2024-01-09 Referred to Committee on Judiciary, H 2024-01-10 Member(s) request name added as sponsor: Felder",Failed,6bda99a5838e5b13b8f81badbbd8b1b3,1784422,https://www.scstatehouse.gov/sess125_2023-2024/prever/4540_20231116.htm,,https://drive.google.com/open?id=11yMM1oZGrlovl8_C__CsCI5Cysl_Vhhx
South Carolina,H4619,"Gender Reassignment, Minors",Gender Affirming Care Ban,1/9/2024,Member(s) request name added as sponsor: S.Jones,Worst,High,Aiding and abeiting clause. Under 18 -Allison; A Help Not Harm Act - Liz,https://legiscan.com/SC/bill/H4619/2023,"Melissa Oremus, Ashley Trantham, Josiah Magnuson, Thomas Pope, Brandon Guffey, Stewart Jones",,"H 2023-11-16 Prefiled, H 2023-11-16 Referred to Committee on Medical, Military, Public and Municipal Affairs, H 2024-01-09 Introduced and read first time, H 2024-01-09 Referred to Committee on Medical, Military, Public and Municipal Affairs, H 2024-01-09 Member(s) request name added as sponsor: S.Jones",Failed,2d11f0ff482c23b9aad80824b3da2311,1784436,https://www.scstatehouse.gov/sess125_2023-2024/prever/4619_20231116.htm,,https://drive.google.com/open?id=1Xccr7Ubzcar9ufydOGb1IwselxhCekK9
South Carolina,H4624,Gender Reassignment Procedures,Gender Affirming Care Ban/ Forced Outing By Schools,5/29/2024,Act No. 203,Worst,High,"Aiding and abeiting clause. GAC under 18 WITH EXCEPTION FOR UNDER 26 for MEDICAID. forced outing in schools.  Public fund ban on GAC for all ages. forced detransition. immedietly takes effect. -Allison; A Family Policy Alliance ""Help Not Harm Act"" - Liz",https://legiscan.com/SC/bill/H4624/2023,"Davey Hiott, Murrell Smith, John Mccravy, Sylleste Davis, David Vaughan, Ashley Trantham, Thomas Pope, Don Chapman, Bill Taylor, Melissa Oremus, Tom Hartnett, Matthew Leber, Steven Long, Roger Nutt, Patrick Haddon, James Burns, William Chumley, Christopher Murphy, Cody Mitchell, Gary Brewer, Robby Robbins, Gil Gatch, John West, Doug Gilliam, April Cromer, Jay Kilmartin, David O'Neal, Richard Yow, Stewart Jones, Kathy Landing, Nathan Ballentine, William Sandifer, Heather Crawford, Val Guest, Mark Willis, Randy Ligon, Cally Forrest, Jordan Pace, Weston Newton, Jeffrey Bradley, Shannon Erickson, Daniel Gibson, Bart Blackwell, Marvin Smith","Hearing 2024-01-09 00:00 Blatt Room 427, Hearing 2024-01-09 00:00 Blatt Room 427 - Hybrid, Hearing 2024-01-09 00:00 Blatt Room 110 - Hybrid, Hearing 2024-01-10 10:00 Blatt Room 110, Hearing 2024-02-14 10:00 Gressette Room 308, Hearing 2024-02-15 10:00 Gressette Room 308, Hearing 2024-02-21 11:00 Gressette Room 105, Hearing 2024-02-29 09:00 Gressette Room 105","H 2023-11-16 Prefiled, H 2023-11-16 Referred to Committee on Medical, Military, Public and Municipal Affairs, H 2024-01-09 Introduced and read first time, H 2024-01-09 Referred to Committee on Medical, Military, Public and Municipal Affairs, H 2024-01-09 Member(s) request name added as sponsor: Long, Nutt, Haddon, Burns, Chumley, Murphy, Mitchell, Brewer, Robbins, Gatch, West, Gilliam, Cromer, Kilmartin, O'Neal, Yow, S.Jones, H 2024-01-10 Member(s) request name added as sponsor: Landing, Ballentine, Sandifer, Crawford, Guest, H 2024-01-10 Committee report: Favorable with amendment Medical, Military, Public and Municipal Affairs, H 2024-01-11 Requests for debate-Rep, H 2024-01-11 Member(s) request name added as sponsor: Willis, Ligon, Forrest, H 2024-01-16 Member(s) request name added as sponsor: Pace, H 2024-01-16 Requests for debate-Rep, H 2024-01-17 Member(s) request name added as sponsor: W.Newton, Bradley, Erickson, Gibson, Blackwell, M.M.Smith, H 2024-01-17 Amended, H 2024-01-17 Read second time, H 2024-01-17 Roll call Yeas-82 Nays-23, H 2024-01-18 Read third time and sent to Senate, S 2024-01-18 Introduced and read first time, S 2024-01-18 Referred to Committee on Medical Affairs, S 2024-03-05 Committee report: Favorable with amendment Medical Affairs,  2024-03-06 Scrivener's error corrected",Enacted,f645be830622ea0a61661168ec9e9aa6,1784388,"https://www.scstatehouse.gov/sess125_2023-2024/prever/4624_20231116.htm, https://www.scstatehouse.gov/sess125_2023-2024/prever/4624_20240110.htm, https://www.scstatehouse.gov/sess125_2023-2024/prever/4624_20240117.htm, https://www.scstatehouse.gov/sess125_2023-2024/prever/4624_20240305.htm, https://www.scstatehouse.gov/sess125_2023-2024/prever/4624_20240306.htm",,https://drive.google.com/open?id=1Ip-ZJ9Wk3OPV8WUH6wqzTuKKPJ5Glu2t
South Carolina,H4654,Public school libraries,Book Ban,1/9/2024,Referred to Committee on Education and Public Works,Worst,High,,https://legiscan.com/SC/bill/H4654/2023,"April Cromer, Roger Nutt",,"H 2023-12-14 Prefiled, H 2023-12-14 Referred to Committee on Education and Public Works, H 2024-01-09 Introduced and read first time, H 2024-01-09 Referred to Committee on Education and Public Works",Failed,f7b3dc7a9e08bc89f901a7ad044bf6c8,1792124,https://www.scstatehouse.gov/sess125_2023-2024/prever/4654_20231214.htm,,https://drive.google.com/open?id=1gu6W4lMFwzpYbq8nHyq7s7iV5KF4fJWQ
South Carolina,H4663,"Diversity, Equity, and Inclusion",DEI Ban,1/9/2024,Referred to Committee on Judiciary,Worst,High,,https://legiscan.com/SC/bill/H4663/2023,"Thomas Beach, Cody Mitchell, Brandon Guffey, Brandon Cox, Brian Lawson, Roger Nutt, Matthew Leber",,"H 2023-12-14 Prefiled, H 2023-12-14 Referred to Committee on Judiciary, H 2024-01-09 Introduced and read first time, H 2024-01-09 Referred to Committee on Judiciary",Failed,5c1eea3116dd4aba7ee8bff1164d4a2e,1792223,https://www.scstatehouse.gov/sess125_2023-2024/prever/4663_20231214.htm,,https://drive.google.com/open?id=15jbblvU1dgqnI4r9dNF_pmEpJbO_FQWz
South Carolina,H4689,Children's Device Protection Act,Online Obscenity Law,1/25/2024,Member(s) request name added as sponsor: Hyde,Worst,High,,https://legiscan.com/SC/bill/H4689/2023,"Travis Moore, Brandon Guffey, Jerry Carter, Thomas Pope, Don Chapman, Bill Taylor, Tom Hartnett, John West, Raye Felder, Randy Ligon, Brian Lawson, Dennis Moss, Brandon Cox, Max Hyde",,"H 2023-12-14 Prefiled, H 2023-12-14 Referred to Committee on Judiciary, H 2024-01-09 Introduced and read first time, H 2024-01-09 Referred to Committee on Judiciary, H 2024-01-09 Member(s) request name added as sponsor: West, H 2024-01-10 Member(s) request name added as sponsor: Felder, H 2024-01-24 Member(s) request name added as sponsor: Ligon, Lawson, Moss, B.L.Cox, H 2024-01-25 Member(s) request name added as sponsor: Hyde",Failed,98e55650ef1e90532ebc3467f551ddd4,1792177,https://www.scstatehouse.gov/sess125_2023-2024/prever/4689_20231214.htm,,https://drive.google.com/open?id=1U5fV9V4ppOAiSMJ03iuV3D32_UlhzuLL
South Carolina,H4691,"Amend The South Carolina Code Of Laws By Adding Chapter 23 To Title 63 So As To Recognize That Parents Have The Ultimate Responsibility To Direct The Upbringing, Education, Health Care, And Mental Health Of Their Children; To Prohibit The State From Substantially Burdening Those Parental Rights And To Require The State To Obtain Parental Consent In Certain Circumstances; To Create A Cause Of Action For Violation Of The Chapter; And For Other Purposes.",Forced Outing By Schools,2/28/2024,"Member(s) request name added as sponsor: S.Jones, White, Magnuson, Harris, Pace, T.Moore",Worst,High,May require forced outing by requiring informing parents of referals or evaluation of student's mental health depending on interpretation,https://legiscan.com/SC/bill/H4691/2023,,,,Failed,,,,,
South Carolina,H4701,READER Act,Book Ban,1/9/2024,Referred to Committee on Education and Public Works,Worst,High,,https://legiscan.com/SC/bill/H4701/2023,"Micajah Caskey, Brandon Guffey, Thomas Pope, Roger Nutt",,"H 2023-12-14 Prefiled, H 2023-12-14 Referred to Committee on Education and Public Works, H 2024-01-09 Introduced and read first time, H 2024-01-09 Referred to Committee on Education and Public Works",Failed,200adb7a91ae713b25a22bc2b80750e4,1792138,https://www.scstatehouse.gov/sess125_2023-2024/prever/4701_20231214.htm,,https://drive.google.com/open?id=1n_umUt45vYRCqK6787w5Aw5fJRkCGG0M
South Carolina,H4707,School board review of curriculum,Don't Say Gay/Forced Outing By Schools,1/9/2024,Referred to Committee on Education and Public Works,Worst,High,,https://legiscan.com/SC/bill/H4707/2023,Jordan Pace,,"H 2023-12-14 Prefiled, H 2023-12-14 Referred to Committee on Education and Public Works, H 2024-01-09 Introduced and read first time, H 2024-01-09 Referred to Committee on Education and Public Works",Failed,9b546c7a0090e2bf6f4c094f8cfc56e2,1792136,https://www.scstatehouse.gov/sess125_2023-2024/prever/4707_20231214.htm,,https://drive.google.com/open?id=10Xz83a_XBrfn3Xdp1OrwMkOnONsHXa05
South Carolina,H5100,"Make Appropriations And To Provide Revenues To Meet The Ordinary Expenses Of State Government For The Fiscal Year Beginning July 1, 2024, To Regulate The Expenditure Of Such Funds, And To Further Provide For The Operation Of State Government During This Fiscal Year And For Other Purposes.",Trans Bathroom Ban / Appropriations,6/27/2024,Ratified R 252,Worst,High,State Budget bill with an amendment (No. 48) which contains a version of the Student Privacy Act - a school trans bathroom/locker room ban.,https://legiscan.com/SC/bill/H5100/2023,,,,Enacted,,,,,
South Carolina,H5407,"Amend The South Carolina Code Of Laws By Enacting The ""south Carolina Student Physical Privacy Act"" By Adding Article 4 To Chapter 23, Title 59 So As To Provide Definitions, Provide That Every Public School Restroom And Changing Facility That Is Accessible By Multiple Persons Must Be Designated For Use Only By Members Of One Sex, And To Provide Civil Penalties.",Trans Bathroom Ban,4/16/2024,Referred to Committee on Judiciary,Worst,High,Yet another Student Physical Privacy Act; a version was added into H5100 as an amendment,https://legiscan.com/SC/bill/H5407/2024,,,,Failed,,,,,
South Carolina,S1213,South Carolina Student Physical Privacy Act,Trans Bathroom Ban,3/27/2024,Referred to Committee on Education,Worst,High,"Yet another iteration of Alliance Defending Freedom's ""Student Physical Privacy Act"", model legislation dating back to December 2014",https://legiscan.com/SC/bill/S1213/2023,"Wes Climer, Joshua Kimbrell",,"S 2024-03-27 Introduced and read first time, S 2024-03-27 Referred to Committee on Education",Failed,a4922974dda19646e214d08c077f8819,1868172,https://www.scstatehouse.gov/sess125_2023-2024/prever/1213_20240327.htm,,https://drive.google.com/open?id=1cxKAGWcji6GE610BCpk36-9bt7ZD-JDc
South Dakota,HB1113,Prohibit the use of state resources for the provision of lewd or lascivious content.,Book Ban,1/24/2024,"State Affairs Deferred to the 41st legislative day, Passed, YEAS 7, NAYS 4.",Worst,Moderate,,https://legiscan.com/SD/bill/HB1113/2024,"Carl Perry, Aaron Aylward, Rocky Blare, Julie Frye-Mueller, Phil Jensen, Ben Krohmer, Scott Moore, Tina Mulally, Brian Mulder, Tom Pischke, Brandei Schaefbauer",Hearing 2024-01-24 00:00 ,"H 2024-01-18 First read in House and referred to House State Affairs H.J. 84, H 2024-01-24 Scheduled for hearing H.J. 1, H 2024-01-24 State Affairs Motion to amend, Passed Amendment 1113A, H 2024-01-24 State Affairs Deferred to the 41st legislative day, Passed, YEAS 7, NAYS 4.",Failed,9caaa47c9c7d11dc35cb803a31de7f89,1819718,https://mylrc.sdlegislature.gov/api/Documents/260482.pdf,,https://drive.google.com/open?id=1KWrzfHuhZ3t3JmnqPDMQ7yur3YVGPlU3
South Dakota,HB1178,Prohibit the Board of Regents or any institution under its control from using state resources for obscene live conduct.,Drag Ban,3/26/2024,"Signed by the Governor on March 26, 2024 H.J. 514",Worst,Moderate,,https://legiscan.com/SD/bill/HB1178/2024,"Chris Karr, Al Novstrup, Julie Auch, Aaron Aylward, Jessica Bahmuller, Rocky Blare, Fred Deutsch, Julie Frye-Mueller, Jon Hansen, Phil Jensen, Ben Krohmer, Karla Lems, Elizabeth May, Brian Mulder, Marty Overweg, Carl Perry, Neal Pinnow, Tom Pischke, Brandei Schaefbauer, John Sjaarda, Jim Stalzer, Kenneth Teunissen","Hearing 2024-02-12 00:00 , Hearing 2024-02-23 00:00 ","H 2024-01-25 First read in House and referred to House State Affairs H.J. 176, H 2024-02-12 Scheduled for hearing H.J. 1, H 2024-02-12 State Affairs Do Pass, Passed, YEAS 11, NAYS 2., H 2024-02-13 House of Representatives Do Pass, Passed, YEAS 59, NAYS 8. H.J. 321, S 2024-02-14 First read in Senate and referred to Senate State Affairs S.J. 328, S 2024-02-23 Scheduled for hearing, S 2024-02-23 State Affairs Motion to amend, Passed, YEAS 5, NAYS 3. Amendment 1178A, S 2024-02-23 State Affairs Do Pass Amended, Passed, YEAS 7, NAYS 1., S 2024-02-27 Senate Do Pass Amended, Passed, YEAS 27, NAYS 5. S.J. 431, H 2024-02-29 House of Representatives Concurred in amendments, Passed, YEAS 62, NAYS 7. H.J. 439, H 2024-03-04 Signed by the Speaker H.J. 468, S 2024-03-05 Signed by the President S.J. 481, H 2024-03-05 Delivered to the Governor on March 05, 2024 H.J. 474, H 2024-03-26 Signed by the Governor on March 26, 2024 H.J. 514",Enacted,430d8e4828db34b86467da95feb979c0,1828226,"https://mylrc.sdlegislature.gov/api/Documents/262772.pdf, https://mylrc.sdlegislature.gov/api/Documents/266384.pdf, https://mylrc.sdlegislature.gov/api/Documents/267000.pdf",,https://drive.google.com/open?id=1x_FiW6yMa778ZXVQNyKFu2MXzPZQnmY_
South Dakota,HB1197,Require the publication of measures taken to restrict the access of obscene materials by minors.,Online Obscenity Law,3/6/2024,"Signed by the Governor on March 06, 2024 H.J. 484",Worst,Moderate,,https://legiscan.com/SD/bill/HB1197/2024,"Steve Kolbeck, Mike Stevens, Amber Arlint, Aaron Aylward, Hugh Bartels, Rocky Blare, Kirk Chaffee, Casey Crabtree, Sydney Davis, Fred Deutsch, Michael Diedrich, Linda Duba, Julie Frye-Mueller, Randy Gross, Jon Hansen, Mellissa Heermann, Jean Hunhoff, Kevin Jensen, Phil Jensen, David Johnson, Jack Kolbeck, Lance Koth, David Kull, Elizabeth May, Scott Moore, Will Mortenson, Brian Mulder, Scott Odenbach, Carl Perry, Neal Pinnow, Tom Pischke, Taylor Rehfeldt, Rebecca Reimer, Tim Reisch, Michael Rohl, Stephanie Sauder, Lee Schoenbeck, Jim Stalzer, Kenneth Teunissen, James Wangsness, Mike Weisgram, Larry Zikmund","Hearing 2024-02-05 00:00 , Hearing 2024-02-22 00:00 ","H 2024-01-29 First read in House and referred to House Education H.J. 186, H 2024-02-05 Scheduled for hearing, H 2024-02-05 Education Do Pass, Passed, YEAS 14, NAYS 0., H 2024-02-06 House of Representatives Do Pass, Passed, YEAS 67, NAYS 0. H.J. 265, S 2024-02-07 First read in Senate and referred to Senate Judiciary S.J. 278, S 2024-02-13 Referred to Senate Education, Passed S.J. 310, S 2024-02-22 Scheduled for hearing, S 2024-02-22 Education Do Pass, Passed, YEAS 6, NAYS 0., S 2024-02-22 Certified uncontested, placed on consent, S 2024-02-23 Senate Do Pass, Passed, YEAS 32, NAYS 0. S.J. 399, H 2024-02-26 Signed by the Speaker H.J. 406, S 2024-02-27 Signed by the President S.J. 436, H 2024-02-28 Delivered to the Governor on February 28, 2024 H.J. 420, H 2024-03-06 Signed by the Governor on March 06, 2024 H.J. 484",Enacted,372e43bd998a652d9b314e5a2990f491,1830210,"https://mylrc.sdlegislature.gov/api/Documents/263081.pdf, https://mylrc.sdlegislature.gov/api/Documents/266420.pdf",,https://drive.google.com/open?id=1nxjCfMU7b4xyQzI7HIJLRQgFfyJPF7xn
South Dakota,HB1257,Require the Executive Board of the Legislative Research Council to establish an interim study committee on minors' access to pornographic material.,Online Obscenity Law,3/7/2024,"House of Representatives Failed to concur, no committee appointed, Passed, YEAS 44, NAYS 26. H.J. 504",Worst,Moderate,,https://legiscan.com/SD/bill/HB1257/2024,"Jim Mehlhaff, Bethany Soye, Julie Auch, Aaron Aylward, Rocky Blare, Fred Deutsch, Red Foster, Julie Frye-Mueller, Randy Gross, Jon Hansen, Brent Hoffman, Phil Jensen, Karla Lems, Elizabeth May, John Mills, Tina Mulally, Brian Mulder, Carl Perry, Sue Lucas-Peterson, Neal Pinnow, Tom Pischke, Tony Randolph, John Sjaarda","Hearing 2024-02-14 00:00 , Hearing 2024-02-29 00:00 ","H 2024-01-31 First Reading House H.J. 214, H 2024-02-01 Referred to House Judiciary H.J. 227, H 2024-02-14 Scheduled for hearing, H 2024-02-14 Judiciary Motion to amend, Passed Amendment 1257A, H 2024-02-14 Judiciary Do Pass Amended, Passed, YEAS 13, NAYS 0., H 2024-02-20 House of Representatives Do Pass Amended, Passed, YEAS 62, NAYS 6. H.J. 360, S 2024-02-21 First read in Senate and referred to Senate Judiciary S.J. 375, S 2024-02-29 Scheduled for hearing, S 2024-02-29 Judiciary Deferred to the 41st legislative day, Passed, YEAS 4, NAYS 3., S 2024-03-04 Recalled from committee (Rule 7-7) Senate Judiciary, Passed S.J. 473, S 2024-03-04 Judiciary Report out of committee without recommendation, Passed, S 2024-03-04 Placed on calendar pursuant to JR 6F-6, Passed, YEAS 33, NAYS 0., S 2024-03-04 Senate Motion to amend, Passed S.J. 474 Amendment 1257C, S 2024-03-04 Senate Motion to amend, Passed S.J. 474 Amendment 1257D, S 2024-03-04 Senate Do Pass Amended, Passed, YEAS 32, NAYS 1. S.J. 475, H 2024-03-05 House of Representatives Failed to concur, appoint Conference Committee, Passed, YEAS 63, NAYS 7., S 2024-03-05 Senate Conference Committee appointments S.J. 487, S 2024-03-06 Senate Conference Committee report not adopted, no committee appointed, Passed, YEAS 24, NAYS 10. S.J. 506, S 2024-03-06 Motion to amend, Passed, YEAS 5, NAYS 0. Amendment 1257E, S 2024-03-06 Conference Committee Report adopted, Failed, YEAS 4, NAYS 1., S 2024-03-06 Conference Committee Report adopted, Failed, YEAS 4, NAYS 2., S 2024-03-06 Failed to concur, appoint Conference Committee, Passed, YEAS 6, NAYS 0., H 2024-03-07 House of Representatives Conference Committee Report H.J. 499, H 2024-03-07 House of Representatives Failed to concur, no committee appointed, Passed, YEAS 44, NAYS 26. H.J. 504",Failed,ce9543b75de873794266c1c98ee4f393,1833473,"https://mylrc.sdlegislature.gov/api/Documents/264118.pdf, https://mylrc.sdlegislature.gov/api/Documents/265627.pdf, https://mylrc.sdlegislature.gov/api/Documents/267173.pdf",,https://drive.google.com/open?id=19JuG7sMNHUIcEVXbA3_c0IJEDPPhZ4d5
South Dakota,SB184,Expand provisions regarding the protection of minors from certain exhibitions.,Drag Ban,2/13/2024,"Education Deferred to the 41st legislative day, Passed, YEAS 5, NAYS 1.",Worst,Moderate,,https://legiscan.com/SD/bill/SB184/2024,"Julie Frye-Mueller, Aaron Aylward, Phil Jensen, Carl Perry, Tom Pischke","Hearing 2024-02-06 00:00 , Hearing 2024-02-08 00:00 , Hearing 2024-02-13 00:00 ","S 2024-01-25 First read in Senate and referred to Senate Education S.J. 179, S 2024-02-08 Scheduled for hearing, S 2024-02-13 Scheduled for hearing, S 2024-02-13 Education Motion to amend, Passed Amendment 184A, S 2024-02-13 Education Deferred to the 41st legislative day, Passed, YEAS 5, NAYS 1.",Failed,3aa5506de71a8425a52eb03560e9c51a,1828231,https://mylrc.sdlegislature.gov/api/Documents/262820.pdf,,https://drive.google.com/open?id=1yVhBBUSjpjFkcs7ABFuhqfsYY5OxiteV
Tennessee,HB0030,"AN ACT to amend Tennessee Code Annotated, Title 7, Chapter 51, relative to adult cabaret entertainment.",Drag Ban,1/11/2024,Sponsor(s) withdrawn.,Worst,Worst,Carried over from 2023,https://legiscan.com/TN/bill/HB0030/2023,"Clay Doggett, Monty Fritts, Susan Lynn, Chris Todd, Debra Moody, Dennis Powers, Mark Cochran, Paul Sherrell, Jake McCalmon, Bryan Richey, Ed Butler, William Slater, Ryan Williams, Kip Capley, Rusty Grills, Johnny Garrett, Kelly Keisling, Dan Howell, John Ragan, Todd Warner","Hearing 2023-02-08 15:30 House Hearing Room II, Hearing 2023-02-14 13:30 House Hearing Room I, Hearing 2023-02-22 10:30 House Hearing Room III, Hearing 2023-02-28 15:00 House Hearing Room I","H 2023-01-05 Filed for introduction, H 2023-01-10 Intro., P1C., H 2023-01-11 P2C held on desk, pending appointment of Standing Committees, H 2023-01-12 Ref. to Local Government Committee, H 2023-01-12 Assigned to s/c Cities & Counties Subcommittee, H 2023-02-01 Placed on s/c cal Cities & Counties Subcommittee for 2/8/2023, H 2023-02-08 Rec for pass if am by s/c ref. to Local Government Committee, H 2023-02-08 Placed on cal. Local Government Committee for 2/14/2023, H 2023-02-14 Rec. for pass. if am., ref. to Finance, Ways, and Means Committee, H 2023-02-15 Assigned to s/c Finance, Ways, and Means Subcommittee, H 2023-02-15 Placed on s/c cal Finance, Ways, and Means Subcommittee for 2/22/2023, H 2023-02-16 Sponsor(s) Added., H 2023-02-22 Rec for pass if am by s/c ref. to Finance, Ways, and Means Committee, H 2023-02-22 Placed on cal. Finance, Ways, and Means Committee for 2/28/2023, H 2023-02-28 Rec. for pass. if am., ref. to Calendar & Rules Committee, H 2023-03-01 Placed on cal. Calendar & Rules Committee for 3/2/2023, H 2023-03-02 H. Placed on Regular Calendar for 3/6/2023, H 2023-03-02 Sponsor(s) Added., H 2023-03-06 Sponsor(s) Added., H 2023-03-06 H. adopted am. (Amendment 2 - HA0052), H 2023-03-06 Am. withdrawn. (Amendment 1 - HA0007), H 2023-03-06 Passed H., as am., Ayes 74, Nays 23, PNV 0, H 2023-03-07 Engrossed; ready for transmission to Sen., S 2023-03-09 Received from House, Passed on First Consideration, H 2024-01-11 Sponsor(s) withdrawn.",Failed,a24f77e66ad7eba94405e01712b6821e,1643934,"https://www.capitol.tn.gov/Bills/113/Bill/HB0030.pdf, https://www.capitol.tn.gov/Bills/113/Bill/HB0030.pdf",,https://drive.google.com/open?id=11EKwCYVwxOU6m3UNmAyNEAcWdSrQMmrC
